{
  "schemaVersion": "1.0.0",
  "auditVersion": "reference-readiness-audit-2.0.0",
  "title": "Reference profile readiness audit",
  "origin": "independent_authoring",
  "authoringBoundary": "independent_authoring",
  "baseline": {
    "candidateBank": {
      "version": "0.20.0",
      "path": "data/items/candidate-v0.20.json",
      "sha256": "c9cf0f05da7bd6adb9117d03d1ee2661d161b2e6112577bb6ec5910d86e78a1d"
    },
    "worldviewModel": {
      "version": "generic-1.17.0-pilot",
      "path": "data/generic/model-v1.17-pilot.json",
      "sha256": "3e605180d211765664d733af6155ea52b88a3f4c5934b02716aedd2078766e13"
    },
    "sourceLedger": {
      "version": "0.21.0",
      "path": "data/generic/source-ledger-v0.21.json",
      "sha256": "1bdd629728c737cbf2c3f4175ce96c6d6f5d04493167ab5969d3ed4be849c7bb"
    },
    "affinityCatalog": {
      "version": "philosophical-affinity-2.8.0",
      "path": "data/affinities/catalog-v2.8.json",
      "sha256": "818bcb95373efafb31e456f5d4bb1c7651036cabc32f2dfa9be81e0293f69b37"
    },
    "progressiveRoutes": {
      "version": "progressive-depth-2.8.0",
      "path": "data/experience/progressive-depth-v2.8.json",
      "sha256": "79d9b47f917ec9ef097b8121216a8ac711c4292e1098b000147e2d347fae89f6"
    },
    "authoringPolicy": {
      "version": "independent-reference-authoring-1.0.0",
      "path": "data/reference/authoring-policy-v1.json",
      "sha256": "b69cb1e0e0928204a8f2eaf9287e52df74f8dca9e18d6c448f0972cb162a7f83"
    }
  },
  "routeOrder": [
    "quick",
    "standard",
    "full"
  ],
  "sources": [
    {
      "id": "sep-pragmatism",
      "title": "Stanford Encyclopedia of Philosophy, Pragmatism",
      "url": "https://plato.stanford.edu/entries/pragmatism/",
      "sourceClass": "signed_scholarly_synthesis"
    },
    {
      "id": "peirce-1878",
      "title": "Charles S. Peirce, How to Make Our Ideas Clear (1878)",
      "url": "https://www.peirce.org/writings/p119.html",
      "sourceClass": "primary_text"
    },
    {
      "id": "sep-peirce",
      "title": "Stanford Encyclopedia of Philosophy, Charles Sanders Peirce",
      "url": "https://plato.stanford.edu/entries/peirce/",
      "sourceClass": "signed_scholarly_synthesis"
    },
    {
      "id": "iep-fallibilism",
      "title": "Internet Encyclopedia of Philosophy, Fallibilism",
      "url": "https://iep.utm.edu/fallibil/",
      "sourceClass": "signed_scholarly_synthesis"
    },
    {
      "id": "locke-essay",
      "title": "John Locke, An Essay Concerning Human Understanding (1690)",
      "url": "https://www.gutenberg.org/files/10615/10615-h/10615-h.htm",
      "sourceClass": "primary_text"
    },
    {
      "id": "sep-rationalism-empiricism",
      "title": "Stanford Encyclopedia of Philosophy, Rationalism vs. Empiricism",
      "url": "https://plato.stanford.edu/entries/rationalism-empiricism/",
      "sourceClass": "signed_scholarly_synthesis"
    },
    {
      "id": "sep-consequentialism",
      "title": "Stanford Encyclopedia of Philosophy, Consequentialism",
      "url": "https://plato.stanford.edu/entries/consequentialism/",
      "sourceClass": "signed_scholarly_synthesis"
    },
    {
      "id": "sep-egoism",
      "title": "Robert Shaver, Egoism",
      "url": "https://plato.stanford.edu/entries/egoism/",
      "sourceClass": "signed_scholarly_synthesis"
    },
    {
      "id": "sep-rand",
      "title": "H. B. Badhwar and R. T. Long, Ayn Rand",
      "url": "https://plato.stanford.edu/entries/ayn-rand/",
      "sourceClass": "signed_scholarly_synthesis"
    },
    {
      "id": "rand-ethics",
      "title": "Ayn Rand, The Objectivist Ethics (1961)",
      "url": "https://courses.aynrand.org/works/the-objectivist-ethics/",
      "sourceClass": "primary_text"
    },
    {
      "id": "sep-anarchism",
      "title": "Andrew Fiala, Anarchism",
      "url": "https://plato.stanford.edu/entries/anarchism/",
      "sourceClass": "signed_scholarly_synthesis"
    },
    {
      "id": "sep-political-obligation",
      "title": "Dagger and Lefkowitz, Political Obligation",
      "url": "https://plato.stanford.edu/entries/political-obligation/",
      "sourceClass": "signed_scholarly_synthesis"
    },
    {
      "id": "sep-hume",
      "title": "Stanford Encyclopedia of Philosophy, David Hume",
      "url": "https://plato.stanford.edu/entries/hume/",
      "sourceClass": "signed_scholarly_synthesis"
    },
    {
      "id": "hume-treatise",
      "title": "David Hume, A Treatise of Human Nature (1739–40)",
      "url": "https://davidhume.org/texts/t/1/1/full",
      "sourceClass": "primary_text"
    },
    {
      "id": "hume-enquiry",
      "title": "David Hume, An Enquiry Concerning Human Understanding (1748)",
      "url": "https://davidhume.org/texts/e/4",
      "sourceClass": "primary_text"
    },
    {
      "id": "hume-enquiry-12",
      "title": "David Hume, An Enquiry Concerning Human Understanding (1748), Section XII",
      "url": "https://davidhume.org/texts/e/12",
      "sourceClass": "primary_text"
    },
    {
      "id": "sep-hume-moral",
      "title": "Stanford Encyclopedia of Philosophy, Hume's Moral Philosophy",
      "url": "https://plato.stanford.edu/entries/hume-moral/",
      "sourceClass": "signed_scholarly_synthesis"
    },
    {
      "id": "mill-utilitarianism",
      "title": "John Stuart Mill, Utilitarianism (1861), Chapter II",
      "url": "https://www.earlymoderntexts.com/assets/pdfs/mill1863_1.pdf",
      "sourceClass": "primary_text"
    },
    {
      "id": "sep-utilitarianism-history",
      "title": "Stanford Encyclopedia of Philosophy, The History of Utilitarianism",
      "url": "https://plato.stanford.edu/entries/utilitarianism-history/",
      "sourceClass": "signed_scholarly_synthesis"
    },
    {
      "id": "analects-eno",
      "title": "Confucius, Analects, translated by Robert Eno",
      "url": "https://scholarworks.iu.edu/dspace/items/12df6d92-4ac2-47d4-8c20-2f8018f2555d/full",
      "sourceClass": "primary_text"
    },
    {
      "id": "sep-confucius",
      "title": "Stanford Encyclopedia of Philosophy, Confucius",
      "url": "https://plato.stanford.edu/entries/confucius/",
      "sourceClass": "signed_scholarly_synthesis"
    },
    {
      "id": "sep-chinese-ethics",
      "title": "Stanford Encyclopedia of Philosophy, Chinese Ethics",
      "url": "https://plato.stanford.edu/entries/ethics-chinese/",
      "sourceClass": "signed_scholarly_synthesis"
    },
    {
      "id": "cicero-finibus",
      "title": "Cicero, De Finibus, Book III",
      "url": "https://penelope.uchicago.edu/Thayer/E/Roman/Texts/Cicero/de_Finibus/3*.html",
      "sourceClass": "primary_text"
    },
    {
      "id": "sep-stoicism",
      "title": "Stanford Encyclopedia of Philosophy, Stoicism",
      "url": "https://plato.stanford.edu/entries/stoicism/",
      "sourceClass": "signed_scholarly_synthesis"
    },
    {
      "id": "sep-analysis",
      "title": "Stanford Encyclopedia of Philosophy, Analysis",
      "url": "https://plato.stanford.edu/entries/analysis/",
      "sourceClass": "signed_scholarly_synthesis"
    },
    {
      "id": "iep-analytic",
      "title": "Internet Encyclopedia of Philosophy, Analytic Philosophy",
      "url": "https://iep.utm.edu/analytic-philosophy/",
      "sourceClass": "signed_scholarly_synthesis"
    }
  ],
  "existingItemLeads": [
    {
      "id": "pragmatic-empty-dispute-draft",
      "candidateId": "tradition-pragmatism",
      "itemId": "EPI104",
      "itemRevision": 1,
      "distinction": "Whether a conceptual disagreement with no conceivable consequence is substantive.",
      "disposition": "adjacent_review_lead",
      "reason": "This unadministered candidate directly approaches the pragmatic maxim and could be reviewed as an additional evidence unit or route discriminator. It does not currently contribute to the public rule; EPI103 and EPI123 form the governed Full-route path."
    },
    {
      "id": "pragmatism-overbroad-counterkey-draft",
      "candidateId": "tradition-pragmatism",
      "itemId": "EPI105",
      "itemRevision": 1,
      "distinction": "Whether meaning can always be settled without considering possible consequences for experience or conduct.",
      "disposition": "not_a_substitute",
      "reason": "This unadministered candidate is an overbroad reverse-key statement: the pragmatic maxim does not imply that every philosophical distinction is settled by experiential consequences. It should not be used as an opposition pole without semantic review."
    },
    {
      "id": "rational-egoism-drafts",
      "candidateId": "tradition-ethical-egoism",
      "itemId": "NEI103",
      "itemRevision": 1,
      "distinction": "Whether an agent's own long-term good supplies the ultimate practical reason.",
      "disposition": "not_a_substitute",
      "reason": "NEI103–NEI105 target rational egoism about practical reasons. They are not in public routes and cannot establish whether moral rightness requires maximizing the agent's own good."
    },
    {
      "id": "egoism-independent-need-scenario",
      "candidateId": "tradition-ethical-egoism",
      "itemId": "NEI121",
      "itemRevision": 1,
      "distinction": "Whether another person's need supplies an independent moral reason when helping does not advance one's own good.",
      "disposition": "partial_existing_evidence",
      "reason": "This scenario is already used by construct-NE15 on Full and can help assess exclusive moral self-priority. It does not test whether rightness is constituted by maximizing the agent's own good."
    },
    {
      "id": "family-role-authority-draft",
      "candidateId": "tradition-early-confucian-ethics",
      "itemId": "MFI005",
      "itemRevision": 2,
      "distinction": "Whether inherited roles or authority can have moral value apart from immediate consequences.",
      "disposition": "not_a_substitute",